,title,score,id,flairs,url,n_comments,created,body
346,Is Running Safe For Me With Constant Heart Rate          ,1,pu7hbv,Lifestyle,https://www.reddit.com/r/Anxiety/comments/pu7hbv/is_running_safe_for_me_with_constant_heart_rate/,3,2021-09-23,Hello    I was wondering if Running is safe for me since I have fast heart rate  I am a teenager who exhibits heart rate resting constantly at           However  when lightly jogging and walking sometimes it spikes to     to       I am currently trying to run to help with the treatment with my GAD   Depression  I was wondering what would be a safe heart rate for me 
347,THOUGHTS   ,2,pu7f6o,Health,https://www.reddit.com/r/Anxiety/comments/pu7f6o/thoughts/,4,2021-09-23,I was bullied a lot when I was a kid  I mean from like age   to     I realized it had an effect on my feelings as an adult I am      but now I am realizing it really screwed up how I see the world  Like I always realized I have depression  anxiety  etc  but now I am realizing those are my baseline  On top of that a lot self hatred   But now I am just frustrated because I wasn t like physically or sexually abused or anything so are my problems  that big   And I have had plenty of times to  fix work  on myself   and somehow I keep regressing  I mean I have done years of therapy  medications  tms  ketamine  recently ect  But somehow all I have ended up with is a lot of unsafe thoughts   Just curious what people s thoughts are   and if there was something specific people might have done for past trauma that helped   Thanks   Andrew
348,Horrible day,1,pu778u,Work/School,https://www.reddit.com/r/Anxiety/comments/pu778u/horrible_day/,1,2021-09-23,Today I had the opportunity to take a retest after school  So I showed up to the class and started the test  Right away I started to depersonalize and get a little anxious  But as I got to the middle of the test I couldn t understand anything and I was holding back sobbing from the anxiety and depersonalization  As I walked home I couldn t tell what was real and couldn t breath while I was crying all th way home  Idk if I m fully back yet even   hours after rh fact 
349,I feel like a failure because I had to leave school,2,pu76ly,Advice Needed,https://www.reddit.com/r/Anxiety/comments/pu76ly/i_feel_like_a_failure_because_i_had_to_leave/,1,2021-09-23,TLDR  Is it possible to overcome feelings of deep regret over something  even if it was out of my own control   I had to leave school because of a few different mental health issues that I was facing  anxiety and depression being at the forefront of it   Ever since I left  I haven t been able to leave my house or see my friends  This has all happened during the majority of my teenage years  and I m so scared that I ll never be able to catch up developmentally   All the memories I ve missed out on  all the growing  I feel like a failure and am filled with regret  even though if I didn t leave school I probably would have taken my own life   I know mental illness is a very real and valid reason for this happening  but I struggle with self compassion since I can t actually see mental illness  I m not physically chained to my house  yet I can t bring myself to leave  I keep asking myself what if I tried harder  Maybe did something differently   Does anyone know if it s possible to overcome these feelings of regret and possible self hatred 
350,Daily vomiting every morning for a month  Please help me ,1,pu7469,Advice Needed,https://www.reddit.com/r/Anxiety/comments/pu7469/daily_vomiting_every_morning_for_a_month_please/,5,2021-09-23,Wondering if anyone else has experienced this or has any insight that might help me   I    F  have generalized anxiety disorder  and have had it since I was a kid   In the past  I have experienced feeling sick to my stomach and vomiting when I was very anxious  but it was always one day and then it would go away for a period of time  It would happen on the day of big events usually   About a month ago  after a very stressful period  I started waking up feeling sick to my stomach and I would vomit within about   minutes of waking up  I have thrown up almost every day in the last month  After I throw up  I feel much better and don t feel sick for the rest of the day   The only thing that has brought me any relief is going for a walk immediately after waking up  but sometimes the feeling is too strong and I throw up before I can go on my walk   This is affecting my sleep and my ability to work in the mornings  And obviously  no one wants to be sick every single day   So    what is this  I am particularly perplexed by the fact that I feel better a sense of relief after throwing up  How do I intervene  What kind of professional can help me  I have discussed with my doctor and psychologist and they are both at a loss  Has anyone else experienced this   Edit  I have seen a psychiatrist and have been on many different anxiety meds  currently on Zoloft  and have seen a CBT psychologist for the last   years 
351,Things to help reduce palpitations,2,pu6y5t,Advice Needed,https://www.reddit.com/r/Anxiety/comments/pu6y5t/things_to_help_reduce_palpitations/,5,2021-09-23,My daughter has been having palpitations since she got the depo shot a little over a week ago  They happen randomly  Yesterday they happened at school but today they didn t  They mainly happen at home when she is in bed and I can tell it s worrying her  I took her to the ER a few days ago and they found nothing wrong  It s really causing my anxiety to peak  I was wondering if there are any teens on here that deal with it and what do you guys do to reduce it  I hate that I ve given a lot of my anxiety to her probably at birth  No child should have to worry about things like this  It sucks
352,I just feel like my life is slipping away through my fingertips,65,pu6v44,Needs A Hug/Support,https://www.reddit.com/r/Anxiety/comments/pu6v44/i_just_feel_like_my_life_is_slipping_away_through/,7,2021-09-23,I don t know where the hell the time is going  I feel so numb and unable to articulate my thoughts  I wake up and do my work for the day  do chores  make food and before I know it  it s      pm and that s when I suddenly feel like I ve wasted my entire day  I want to have the energy to do things that make me feel good  I feel like I have this burning flame inside a locked door inside of me that one day is just going to erupt and I m suddenly going to be able to feel again  It s like my anxious thoughts have completely worn out every fabric of my being and what s left is a numb shell of a person just floating through the day  I m on a waiting list for therapy and it couldn t come sooner but I just don t know how to cope with myself until then 
353,I m getting anxiety after my covid vaccine,1,pu6l8j,Health,https://www.reddit.com/r/Anxiety/comments/pu6l8j/im_getting_anxiety_after_my_covid_vaccine/,10,2021-09-23,I ve always been anxious about getting and am scared cuz of the number of adverse effects that have been happening  Can someone help
354,I m falling back in after a summer of calm ,1,pu6j5s,Therapy,https://www.reddit.com/r/Anxiety/comments/pu6j5s/im_falling_back_in_after_a_summer_of_calm/,0,2021-09-23,I m falling back in after a summer of calm  Over the summer I didn t think about my ocd for more than five minutes a day and when I did think about it  it was more of a thing like thinking about my topic not actually having anxiety over it  But now it feels like I m starting to fall back in  Ever since school opened my thought have started to evolve again which they stoped doing over summer  Any tips  I m scared the anxiety will be back 
355,What was your weird childhood phobia that you now realize was a symptom of anxiety ,3,pu68os,Discussion,https://www.reddit.com/r/Anxiety/comments/pu68os/what_was_your_weird_childhood_phobia_that_you_now/,14,2021-09-23,it was balloons and music boxes for me   it was earth worms for my brother 
356,first time taking buspar buspirone   need advice,1,pu644a,Medication,https://www.reddit.com/r/Anxiety/comments/pu644a/first_time_taking_busparbuspirone_need_advice/,4,2021-09-23,i got prescribed buspirone   mg      mg twice a day  and honestly  i m nervous   i m taking it for my anxiety   i d like to know if anyone has taken this medication and what the side effects were  i m just hoping it doesn t make me nauseous  any other side effects i can handle
357,Anyone ever done intensive partial inpatient or outpatient treatment ,1,pu63hi,Advice Needed,https://www.reddit.com/r/Anxiety/comments/pu63hi/anyone_ever_done_intensive_partial_inpatient_or/,2,2021-09-23,I m struggling with very intense anxiety which is interfering with every part of my life  I m starting to have a very difficult time doing my job   I was thinking that perhaps I need to do something intensive  I think there are some places nearby which offer inpatient or outpatient options  Have any of you ever done this and did you have any success 
358,Prozac   What dosage and week finally made a difference ,1,pu5wno,Medication,https://www.reddit.com/r/Anxiety/comments/pu5wno/prozac_what_dosage_and_week_finally_made_a/,0,2021-09-23,I m on   mg of Prozac on week   for extreme anxiety  depression  and stress because I let it go unmanaged for so long  Like crying every day  fear of dying  multiple panic attacks  etc     x   B   I m just wondering when I should feel a difference  lately it s felt like it s made my anxiety worse  but I have hope 
359,I feel deeply inadequate ,2,pu5te6,Venting,https://www.reddit.com/r/Anxiety/comments/pu5te6/i_feel_deeply_inadequate/,0,2021-09-23,I know that there will always be someone who is better than me at something  that is just part of life  No matter what there is always going to be someone better  But something that I have been struggling immensely with since I was in high school is this feeling of being deeply adequate  I see people around me accomplishing such cool things and each day  I just feel really stuck in my mind  Like I have an internship and run this instagram page  but still I feel  deeply inadequate 
360,This feels like deja vu and it makes me feel crazy,1,pu5r4n,Health,https://www.reddit.com/r/Anxiety/comments/pu5r4n/this_feels_like_deja_vu_and_it_makes_me_feel_crazy/,0,2021-09-23,I ve had heart palpitations since I was a teen  but originally I didn t even notice or worry about them  They did a holter monitor when I was in high school and everything came back fine from what I remember    Then  a few years ago  after my health anxiety first began  I started noticing heart palpitations  a fast heart rate and some mild light headedness when I stood up  I made an appointment with a cardiologist myself  and had all the tests done   an EKG  an ultrasound of my heart and I wore a another holter monitor  At the end they said I had a slightly fast heart rate  but it was nothing to worry about  maybe it was due to my excess weight and I felt relieved there was nothing wrong   At the start of the pandemic I was experiencing some palpitations again  this time at night  but after about a month or so they went away on their own and I chalked it up to stress  I got a new doctor and he performs EKGs as part of routine care  I had one a month ago and again  same slightly fast heart rate as always but nothing to worry about    This past week I ve twice almost convinced myself I m having a heart attack for various reasons pain in my arm or my jaw  or palpitations  I just had my first appointment with a new therapist yesterday and I was excited to start working on my anxiety    Then  this morning  after I ate breakfast I had a fast heart rate  palpitations  and a little dizziness when standing  It s lasted all day and I ve tried and failed to not let it freak me out  I talked to my Mom and she said if it makes me feel better I should just go see a cardiologist again  and initially I agreed but now I m thinking what would be the point    I have a sinking feeling that I m going to go through all of the tests  wear the monitor  and they re just going to tell me it s nothing to worry about  it s my anxiety and or my weight and send me on my way    I don t want there to be anything wrong  I don t want to be sick  but things as they are now make me feel totally crazy  I just feel so stuck and I don t know what to do 
361,Thoughts about CBD ,2,pu5r3w,Medication,https://www.reddit.com/r/Anxiety/comments/pu5r3w/thoughts_about_cbd/,4,2021-09-23,I ve been struggling with anxiety since I can remember without knowing I have anxiety and it keeps getting worse  every time I thought I beat it it comes back stronger  I never took medication to treat it but I smoked weed for    years  and I am   years sober now     when I realised I have anxiety a few years ago  I read books  practiced sport  meditation  change entire life style and diet  even had therapy last year but never wanted to be on any medications  because I believed I can beat it if I can change the way I think and be more aware of my thought    to this day  I still don t know what triggers it  sometimes it seems that it  s coming out of nowhere  the problem is every time my anxiety level is high I become highly dysfunctional as I get physical symptoms  I ve been thinking about CBD for years now as I am becoming more disparate that I can fix     please let me know your thoughts or experience with CBD    thank you all  wish you all the best 
362,Venting about living in a favility that also treats anxiety ,1,pu5p38,Needs A Hug/Support,https://www.reddit.com/r/Anxiety/comments/pu5p38/venting_about_living_in_a_favility_that_also/,0,2021-09-23,Trigger Warning  Criticism  I ve just got to vent  I live in a place for almost two years now that treats people with various diorders  but I came to there because of anxiety   I need support because I feel miserable there and I could leave   but they dont allow me and now would not be good time because of college stress they say  It would be rational to stay  but emotionally I want to leave  I have my own room and stuff   but like the caretakers are making me question my sanity  They will analyze every word I say for discrepancies and accuse me of lying  Once they went so far as to call my school and found out that I did not leave at   but at       It makes me anxiuos now to tell them anything because they will say I always say something different  The thing i can t remember everything of days ago   Tody they shouted at me for not telling them when I would arrive home  I did not because they personally insult me whenever I say I will be late  They say I am shit and every little mistake I may do is immediately a sign that I am not to be trusted or independent enough  And because I cannot be trusted apparently I am not ready to go  I feel so uncomfortable and I want to defend myself  but I cannot stay rational and stand up for myself when I am belittled and treated as I child  I tried many times but it is futile to discuss when they wont listen to the big picture   So I just walk away  because that helps me to calm down a bit  I went there because of my parents  I thought  it would help  but I don t need them  I have a therapist that helps me somewhere else  however the change comes from myself   And I sldo find that I can manage living alone  I just want my own life  a life that is not restricted  but I cant find the strength to say these words  I am afraid of being mocked and that I will be always pushed down no matter what I do  Isnt it human to err 
363,Just left the doctor  and was prescribed antidepressants ,2,pu5lxk,Progress!,https://www.reddit.com/r/Anxiety/comments/pu5lxk/just_left_the_doctor_and_was_prescribed/,4,2021-09-23,Just wanted to share with everyone  bec I m feeling really happy and excited  I m so lucky to have gotten affordable treatment  and to have met a doctor who was so willing to listen to my concerns  I m very excited to start this journey towards bettering my mental health  and I m very hopeful for my future 
364,Is it normal to hear wind blowing in your ear when there is no wind   URGENT ,2,pu54jp,Health,https://www.reddit.com/r/Anxiety/comments/pu54jp/is_it_normal_to_hear_wind_blowing_in_your_ear/,1,2021-09-23,Ok so I have a cold   kinda nearing to end I think  and it was is super bad with like chest heaviness and mucus in chest and coughs and sore throat and mucus in throat and bubble in nose and nasal drip and dizziness and a fever and runny nose and a stuffy nose etc etc all that stuff  and my right ear has been blocked for a couple days because of it I think  I can still hear    So today i noticed I was sitting and I could hear wind blowing in it even tho I was inside  on my bed and it was only in the blocked ear   Idk if this is relevant but I already have tinnitus but I ve had tinnitus for yearsss  anyways will the blocked ear and wind in ear pass after a while and is it a result of the cold  Or is it an ear infection I need to get treated
365,Today is rough ,6,pu4xhx,Needs A Hug/Support,https://www.reddit.com/r/Anxiety/comments/pu4xhx/today_is_rough/,1,2021-09-23,This morning  I woke up at      A M   seven minutes before my first class starts  If it were any other day  I probably would ve cut my losses and skipped  but it was a quiz day  Not only did I wake up late and have to quite literally run out the door  but I couldn t find parking and had to park in the faculty parking lot  I took the quiz and probably bombed it because I missed the review day on Tuesday because I had an appointment and would have to pay a fee if I canceled  A normal person would probably just be bummed out for a bit and move on  However my anxiety has been absolutely bananas today  I feel like my professor is going to think I m dumb     My school related anxiety is bad  A lot of it has to do with my poor performance in school for a lot of years due to undiagnosed mental illness  I m always feeling like I have to prove myself in academic settings  and the smallest mistakes can really squash my self esteem 
366,I Can t Stop Thinking That Everything In The World s Going Wrong     M ,33,pu4r8b,Needs A Hug/Support,https://www.reddit.com/r/Anxiety/comments/pu4r8b/i_cant_stop_thinking_that_everything_in_the/,11,2021-09-23,Everyone seems so sad an angry all of the time  There s hardly ever any positive news  Things from a worldwide perspective just seem to be getting worse and worse  I m so damn sick and tired of having no hope for the future  I can t keep living with this horrible  endlessly pessimistic mindset but I don t know what to do  Maybe it s my fault for not trying hard enough  I need to stop reading the news so much  but not looking at the news doesn t make the bad stuff go away  so what s the point  I m just frustrated with everyone and everything  I wish that I could be happier  I wish that  everyone  could be happier 
367,Crying,23,pu4ov5,Family/Relationship,https://www.reddit.com/r/Anxiety/comments/pu4ov5/crying/,9,2021-09-23,Does anyone else get anxiety or sad about their loved ones dying or getting sick  I can t stop worrying about it and I keep crying thinking about it 
368,Anxiety post or during lockdown,2,pu4olr,Introduction,https://www.reddit.com/r/Anxiety/comments/pu4olr/anxiety_post_or_during_lockdown/,3,2021-09-23,Sorry if this has been asked I m new to this group  just wondering how and if lockdown affected peoples anxiety and if so   how are you coping  
369,I need someone to talk to,2,pu4n85,Advice Needed,https://www.reddit.com/r/Anxiety/comments/pu4n85/i_need_someone_to_talk_to/,1,2021-09-23,There are a few things I need someone s perspective on  I can t think straight at the moment  Is anyone available 
370,How do people deal with  my heart is beating too quickly hard for this situation ,2,pu4lxi,Advice Needed,https://www.reddit.com/r/Anxiety/comments/pu4lxi/how_do_people_deal_with_my_heart_is_beating_too/,4,2021-09-23,I constantly feel like when I do a small activity  like walk upstairs to goto the bathroom I am acutely aware of my heart pumping in my chest    I m not hugely fit or unfit but I think to myself   you re gonna have a heart attack   Does anyone else have this 
371, Find something to calm yourself  bitch if I could I would ve done it already,60,pu4l11,Venting,https://www.reddit.com/r/Anxiety/comments/pu4l11/find_something_to_calm_yourself_bitch_if_i_could/,12,2021-09-23,All this zen meditation bullshit does nothing for me I m tired of people saying stupid shit
372,Throwing this into the void,3,pu4kz4,Venting,https://www.reddit.com/r/Anxiety/comments/pu4kz4/throwing_this_into_the_void/,4,2021-09-23,It s almost as if I ve had a non stop anxiety attack today  I just can t seem to calm myself down    I m going from being a crying mess to having stomach knots and racing thoughts    Can t eat  Can t settle  Can t focus    I just wanna chill out  man 
373,My job makes me feel anxious,6,pu4ede,Work/School,https://www.reddit.com/r/Anxiety/comments/pu4ede/my_job_makes_me_feel_anxious/,0,2021-09-23,I got my first job and my partners and me are learning how to work  to use some programmes   I have always been really shy and introvert  so I am not really participative  not like my partners  Also  it s my first job and I feel insecure about no being able to do it  To this  my trainer doesn t help  she really compares me to my partners and humillates me saying I am the slowest learner So when I have to talk at loud I feel a lack of air and my heart goes really fast  I just don t Know What to do  I have only been working two weeks and I won t quick it  I like what I have to do in my job  it s just the people Who makes me feel awful 
374,The Cycle,4,pu495k,Discussion,https://www.reddit.com/r/Anxiety/comments/pu495k/the_cycle/,0,2021-09-23,Anxiety makes me get stressed and unproductively slow  or do bad rushed work  which in turns makes me anxious  which in turn   Gah  I am normally considered competent and reliable at work  but the moment I get the feeling someone thinks I am stupid or made a mistake or is hard to please it s almost as if I make the bad stuff happen because of how anxious I get         Anybody have any suggestions for this particular spiral 
375,Vertigo,2,pu47js,Discussion,https://www.reddit.com/r/Anxiety/comments/pu47js/vertigo/,4,2021-09-23,Just had my first experience with severe vertigo  Everything started to spin  Lasted for maybe a minute  Heart rate skyrocketed  Anyone else have this along with panic anxiety 
376,Parental Anxiety,2,pu3zix,Family/Relationship,https://www.reddit.com/r/Anxiety/comments/pu3zix/parental_anxiety/,1,2021-09-23,I am a   F who has suffered from anxiety and depression for most of my adolescent and adult life  Since having my daughter nearly    months ago  my anxiety has manifested into what I have found is called parental anxiety  I constantly worry about money  even though my husband and I are comfortable  own our home  and can pretty much buy whatever we want or need  I worry about losing our jobs  and in turn losing our home  and not being able to provide for our children the way they should be  I find myself always having to worry about something  and it changes depending on what phase in life I am in  if that makes sense  I absolutely hate this about myself and feel like I am not enjoying life because I am always worrying about something  Any helpful advice out there 
377,I rather not live like this anymore,6,pu3zdo,Needs A Hug/Support,https://www.reddit.com/r/Anxiety/comments/pu3zdo/i_rather_not_live_like_this_anymore/,4,2021-09-23,I can t handle my anxiety anymore  It s actually to much for me  I always thought I was strong enough to keep it under control but honestly I can t  I m so scared  I m scared and weak  I can t breathe right now  I can t even speak up  I just can t do it  Nobody understands and people make speaking look so easy but it s not  It s the scariest thing in the world to me  I hate myself so much why couldn t I have normal anxiety  I literally cannot breathe right now  Nobody understands  And I can t do it  People say don t say can t but I really can t my body won t allow me too be capable of simple things like presenting to a class  I simply will pass out 
378,Not hiding anymore,1,pu3zcp,Venting,https://www.reddit.com/r/Anxiety/comments/pu3zcp/not_hiding_anymore/,0,2021-09-23,I m at the point where I don t even try and hide my depression or anxiety on my face anymore  I can tell people notice but I m just tired of putting on a fake smile so people around me feel better  This is how I feel and I can t help the way it shows 
379,DAE feel little prickling sensations all around their body ,4,pu3ybx,DAE Questions,https://www.reddit.com/r/Anxiety/comments/pu3ybx/dae_feel_little_prickling_sensations_all_around/,4,2021-09-23,
380,Just want to chat,7,pu3op7,Needs A Hug/Support,https://www.reddit.com/r/Anxiety/comments/pu3op7/just_want_to_chat/,23,2021-09-23,Having anxiety  Can anyone relate  What are y all feeling 
381,What will i do,3,pu3nxx,Venting,https://www.reddit.com/r/Anxiety/comments/pu3nxx/what_will_i_do/,1,2021-09-23,I need to go in this certain place to get a result and while i just received a schedule i need to wait for few more days for it  I cant function literally because i cant stop thinking about that schedule and i hate that i will worring it for days while waiting to something im not even sure if im gonna hear a positive or negative result  I dont know how to stop my thoughts and i dont know whats wrong with me
