,title,score,id,flairs,url,n_comments,created,body
202,Am I worrying too much ,1,pulzy6,Medication,https://www.reddit.com/r/Anxiety/comments/pulzy6/am_i_worrying_too_much/,0,2021-09-24,I was prescribed Lorazepam    mg  My doctor said it is okay to take two pills if I feel a strong episode coming on    I did as advised  and this is my first time doing so  but I m worrying about what could happen to me  I am at work and I feel myself relaxing but I still have a slight panicky feeling 
203,My anxiety is ruining my marriage,5,pulxqz,Family/Relationship,https://www.reddit.com/r/Anxiety/comments/pulxqz/my_anxiety_is_ruining_my_marriage/,1,2021-09-24,First time posting  though I ve been reading for a while   I just don t know what else to do   As I said in the title  my anxiety is ruining my marriage    I ve struggled with anxiety for a long time  but it was always manageable   It has been over different things all throughout my life   It would manifest itself for a while  I d struggle with it and it would go away   In general my wife would be good with it   She understood it was just me and who I was and we d get through it   However  the last year has happened     I was laid off from my job during COVID   I really didn t think that d bothered me like it did   It took awhile but I eventually found a job   Not a great one  not in my field exactly  but it was good pay and benefits   Almost immediately I was scared to death to go to work   Throughout the day I would fear any error I made  any feedback I received  any drip in performance   I felt my boss was over bearing   Any time he called me to his office or sent me a email I would freeze  I began throwing up in the mornings before work and crying to my wife that I didn t want to go   On my days off I would sleep constantly because I was so exhausted from just surfing the day  I began seeing a therapist regularly   I just knew it was not the right job for me and I needed to leave     So I found a new job   More in my field  more what I did before getting laid off and with a company known for having a work life balance   Problem solved   Wrong   It is worse     Daily panic attacks  throwing up daily before work  fits of crying where I need to leave the building so no one sees me  I struggle to sleep at night   Usually I wake up around  am and sweat in bed while I watch the clock   On top of all this I m soooooo depressed now because nothing is better I feel so helpless     But the worst part of all this is the impact to my family   My wife is loving and kind   She wakes up with me to help me get ready for work so I can have time to do breathing exercises  she takes my calls and texts when I need someone  but lately it is becoming too much for her   She has her own problems too   She has the kids to worry about and her own life   She is to the point she needs me to be better and all I m doing is getting worse     She said to me in an argument recently that she doesn t believe I m trying hard enough    I explain all the things I m doing and how hard it is just to do those  going to psychiatrist now  breathing exercises  journaling  signed up for stress coaching  etc    I just think she sees things only getting worse so believes I need to do more or something different   She doesn t understand how the smallest things are so hard   I have to pep myself up just to get out of bed and shower     I love my wife and I know she loves me  but we are in a bad place where my anxiety is controlling my life and has been for long enough where it is too much for her   We asked the question today if Maybe it would be better if we weren t together but I can t see how that fixes anything and really would only make things worse     I really don t know what to do anymore   Even if things go fine for a day or two  work still comes next Monday and this whole vicious cycle repeats 
204,Are you looking for a book that will help you with anxiety  Look no further ,0,puluy0,Helpful Tips!,https://www.reddit.com/r/Anxiety/comments/puluy0/are_you_looking_for_a_book_that_will_help_you/,0,2021-09-24,I just finished reading DARE by Barry McDonagh and I absolutely recommend it  I implemented his techniques and I am already in a better place than I was before  And trust me when I say I was in a very bad place  Give it a chance 
205,Does anyone experience shaky vision like all the time ,2,pulu5q,Discussion,https://www.reddit.com/r/Anxiety/comments/pulu5q/does_anyone_experience_shaky_vision_like_all_the/,1,2021-09-24,I know anxiety can do some crazy things to your body but this takes the cake  I have near constant shaky vibrating vision almost every time I space out or stare at something for more than   seconds or so  It feels like my eyes are moving back and forth really quickly but I haven t noticed anything when I record myself    I also feel nauseous all the time lately along with some headaches  This obviously isn t helping my anxiety anymore either  I ve had a clear CT but that hasn t been enough to ease my worries  Just hoping to hear from some of you
206,How do I let go of my worries  It is really making me depressed ,2,pultob,Advice Needed,https://www.reddit.com/r/Anxiety/comments/pultob/how_do_i_let_go_of_my_worries_it_is_really_making/,0,2021-09-24,Hello everyone   So I had this snapchat account where I talked to people I didn t know irl  sometimes on an intimate level   And some intimate pictures of me are saved on there  But a couple of months ago I lost the password and I can not recover it  Snapchat customer support hasn t been helping either   Since then I haven t spent a second not thinking about what could happen if the account gets hacked  I know it is out of my control  I just can t stop thinking about it and it is ruining my day to day life   The password is unguessable  and the email adress connected to it has a very high chance of not even existing  I filled in like       random letters   So the likelihood of something happening to it is very low  But I still can t let it go   Does anybody have any tips on how I can just enjoy life  without being worried all the time    Thank you in advance everyone 
207,The power of Inositol ,2,puliwn,Progress!,https://www.reddit.com/r/Anxiety/comments/puliwn/the_power_of_inositol/,2,2021-09-24,Not sure if this is allowed or not so I apologize in advance if it s not   If anyone has never heard of Inositol powder then here s your chance to find a safe dietary supplement that can kick your panic attacks butt within seconds    All it takes is a few grams of inositol powder in your water and BOOM  your anxiety can be alleviated    I can have some crippling panic attacks but when I take a few gulps of some inositol water then it gets stopped right in it s tracks  I know this is anecdotal and may not work for everyone but it wouldnt hurt to try  It really has helped me so many different times  Do some research and give it a try 
208,What are the best ways to cope with anxiety nausea and palpitations ,2,pulglr,Advice Needed,https://www.reddit.com/r/Anxiety/comments/pulglr/what_are_the_best_ways_to_cope_with_anxiety/,3,2021-09-24,I recently started a new job and even though I m enjoying the work  I get such strong physical anxiety symptoms  that it s making my life really difficult  I ve tried several different things to tackle the nausea and palpitations   breathing exercises  peppermint tablets  CBT  you name it  but I find that no matter how much I think positively  it s as though my body has a mind of its own  It s so frustrating and I m losing weight as a result  which sucks  Has anyone found any methods that help with the physical symptoms of anxiety  Or does anyone else struggle with the same thing  I d appreciate any advice
209,Driving,9,pulffz,Driving,https://www.reddit.com/r/Anxiety/comments/pulffz/driving/,6,2021-09-24,I have to drive nearly everyday and I don t know how much longer I can do it  Driving gives me the worst anxiety  and I ve even had panic attacks on the road  I m awful at parking  I feel embarrassed when I have to correct myself  I feel like other people actively avoid my car on the streets  and I m deathly afraid of car accidents  Worse  I live in Albuquerque where everyone seems to drive with some kind of malicious intent  but I need to drive in order to get to and from school  Anyone else have driving anxiety 
210,So anxious over new job,1,pulefr,Work/School,https://www.reddit.com/r/Anxiety/comments/pulefr/so_anxious_over_new_job/,7,2021-09-24,Basically I declined   job offers to work at a place where I knew some people btw I am a teen and it is my first ever job however  they told me the owner is an a hole and that there are some toxic people    So far  out of   shifts  I haven t seen the owner yet and my co workers who are around my age are pretty nice  But I m so anxious that the other places I rejected seems nicer especially the first place I interviewed I did the orientation but quit shortly after  there was a really cute girl there   I just have anxiety that I made the wrong not best decision and I m embarrassed that I quit declined the offer which seems better now  Any advice 
211,Am I a disgusting person ,264,pul1ru,Venting,https://www.reddit.com/r/Anxiety/comments/pul1ru/am_i_a_disgusting_person/,85,2021-09-24,I am    and a male and have OCD  I ll constantly be anxious over whether my actions were inappropriate  although what I find is a sense of relief in giving into these urges  For example  I ll often find myself adjusting my pants to hide the bulge  but when I ignore this and expose myself I feel a sense of relief  It s as if through giving into an urge I m freeing myself of that anxiety  as wrong as it may feel    My cousin    m  came over today and I was having a ton of intrusive sexual thoughts  it was actually making me really uncomfortable  We went for a walk and I stopped walking in front of him  I can t remember why exactly   my mind started making it feel as if through staying in that position I was somehow giving into an urge  The anxiety revolved around this idea of him  somehow having sex with me from behind  I m straight btw  and it made me feel uncomfortable  for some reason however it felt relieving to stay in that position  despite the discomfort  Could this make me a disgusting human being  Right now I m worrying that I genuinely wanted him to bump into me from behind or something gross like that  Could there be something wrong with me   EDIT  I can thank you guys enough for all the support  I really do appreciate it   
212,Boyfriends close friend died and it s giving me so much anxiety,2,pukz3t,Trigger Warning,https://www.reddit.com/r/Anxiety/comments/pukz3t/boyfriends_close_friend_died_and_its_giving_me_so/,0,2021-09-24,Posting on here because I don t wanna say anything to any of my IRL friends because it s not about me  But I just don t know what to say and it makes me feel awful and so anxious  We are both religious and have had long conversations about consciousness the afterlife before but I don t know how much of that stuff I should evoke now when he says that stuff  And I just don t know what he wants to hear and what will help him the most right now  And we are long distance which doesn t help things at all  And I just feel like I m messing up and our relationship was fragile to begin with and I wish I could see him because I m better with words irl but I can t  And his friend died of an overdose and my boyfriend has been clean for years but I m worried that he ll cope in unhealthy ways
213,Party,2,pukyqp,Helpful Tips!,https://www.reddit.com/r/Anxiety/comments/pukyqp/party/,0,2021-09-24,I have a party that I m going to tommorrow and I want to make new friends but I sorta just sit bymyself the whole time and if I do talk to someone I don t know it s awkward and makes me look weird  Any tips
214,heart attack,2,pukvn2,Helpful Tips!,https://www.reddit.com/r/Anxiety/comments/pukvn2/heart_attack/,2,2021-09-24,hello everyone i am a    m and i have anxiety and health anxiety as well and nowadays whenever i hear or see a post of someone died of heart attack i also think that i will also die of a heart attack and this triggers my anxiety  then i get my chest tight and shortness of breathe  can someone give me tips to overcome this 
215,Constantly creating problems for myself ,3,puksoq,Venting,https://www.reddit.com/r/Anxiety/comments/puksoq/constantly_creating_problems_for_myself/,1,2021-09-24,I m always creating problems for myself  and it s something I can t help   I keep finding that whenever a new problem comes up and I start stressing about that  the previous thing that I ve been worrying about continuously is fine   until that new problem is resolved  and then the old problem comes back and I start stressing about that   It s like I ve got a main problem that I always have to be worrying about  and if I m not worrying about that then I m worrying about something else or something is wrong overall  It doesn t make sense   I get anxious about not being anxious because i start overthinking it and wondering why I m not anxious and what that means  I keep trying to take meanings from things that don t necessarily have any  I know and am trying to learn that not everything has an explanation  but it s so hard because I just overthink everything   I guess this is a rant but also if anyone has any tips  I d really appreciate it if you d put them below 
216,Can I use a Doctor on Demand to get a referral to a psychologist ,2,pukixi,Advice Needed,https://www.reddit.com/r/Anxiety/comments/pukixi/can_i_use_a_doctor_on_demand_to_get_a_referral_to/,1,2021-09-24,Or does it have to be through a primary care  If so  can I make one my primary care doctor  I have never had a primary care doctor  My dads in the military so I grew up with tricare and really struggle to understand the concept of dr structures and insurance as an adult  I had only gone to base hospitals my whole life  I need a psychologist appointment ASAP  I have diagnosed anxiety that I should be taking medication for but ran out 
217,Should I smoke marijuana,6,pukehk,Advice Needed,https://www.reddit.com/r/Anxiety/comments/pukehk/should_i_smoke_marijuana/,15,2021-09-24,Should I smoke it to become more social and less caring of what I am   Does marijuana lower iq
218,Brain zaps,3,pukcal,DAE Questions,https://www.reddit.com/r/Anxiety/comments/pukcal/brain_zaps/,6,2021-09-24,Hey everyone   I was wondering if anyone else experienced brain zaps before NOT DUE to coming off an SSRI  I came off my SSRI more than a year ago so its not from that but I am chronically stressed at an alarming level  has anyone else experienced it  Its like a   second SWOOSH dizzyness type of thing that by the time you notice it  its gone  if that makes sense  wondering what people have done if theyve dealt with it 
219,Just wishing entry level work wasn t all customer service    ,2,pukb9m,Venting,https://www.reddit.com/r/Anxiety/comments/pukb9m/just_wishing_entrylevel_work_wasnt_all_customer/,1,2021-09-24,I live in a rural portion of the Northwest  and it s been incredibly hard to find work during the pandemic outside of hotels and fast food  I am a recovering agoraphobe  so going into an  hr shift is like pulling teeth for me  Most days I just have to escape to the bathroom to cry   Despite all this effort and pain I still can t pay my bills  I love Idaho minimum wage      s  Im putting in the work to get my journalism and mass media degree  but in the meantime I have to make money   I just wish I could find an entry level job that isn t customer service   
220,I hate anxiety  I have an anxiety attack and throw up every morning in preparation in taking my anxiety medicine ,3,pukad6,Medication,https://www.reddit.com/r/Anxiety/comments/pukad6/i_hate_anxiety_i_have_an_anxiety_attack_and_throw/,6,2021-09-24,Like the post states  Its hard for me to take my medicine without puking  I try so many ways to trick myself but it doesn t work  Sometimes i think I tricked myself but I puke right after taking the medicine  Life blows with anxiety 
221,I got almost     bpm heart rate tonight without doing anything ,4,pujy49,Health,https://www.reddit.com/r/Anxiety/comments/pujy49/i_got_almost_140_bpm_heart_rate_tonight_without/,8,2021-09-24,I talked about having heart palpitations every night while having family dinner so dad brought his heart rate monitor  HRM  about     PM to measure my heartbeat  Measured twice and I got almost     BPM both times  My dad has high blood pressure but it s much worse than him  I was a bit stressed because of college assessments and maybe it s side effects from meds or coffee  had one cup today  but I honestly I feel similar every night even without them  No wonder I have a hard time going to sleep  Is this a normal thing for anxiety  Thinking about seeing a doctor regardless 
222,I m having a panic attack I made a bad choice and smoked some weed and I m freaking out I ve also had about   beers how long before I can take a benzo I m prescribed Valium  mg,2,pujxfd,Advice Needed,https://www.reddit.com/r/Anxiety/comments/pujxfd/im_having_a_panic_attack_i_made_a_bad_choice_and/,3,2021-09-24,How long until I can take a benzo after   drinks I m freaking out  I feel like I m dying I feel so hot and cold at the same time my heart hurts I can t breathe I need a benzo how long plz 
223,Anyone else feels like every person is staring at them when they re out ,11,pujv4u,Discussion,https://www.reddit.com/r/Anxiety/comments/pujv4u/anyone_else_feels_like_every_person_is_staring_at/,7,2021-09-24,I always feel like everyone stares at me outside just curious if its for others like that too 
224,I found a therapist ,3,puju4r,Progress!,https://www.reddit.com/r/Anxiety/comments/puju4r/i_found_a_therapist/,2,2021-09-24,That s it  That s the post  I m just super excited I found one who accepts my insurance  and who was accepting clients  My first appointment with her is next week and I can t wait 
225,I had to leave a lecture halfway through because I was having stomach troubles and I m so embarrassed,1,pujnn9,Needs A Hug/Support,https://www.reddit.com/r/Anxiety/comments/pujnn9/i_had_to_leave_a_lecture_halfway_through_because/,1,2021-09-24,I feel so terrible  the professor stopped talking and watched me walk out and I felt everyone stare at me  I know I had to leave because it would ve been a lot more embarrassing if i didn t but now everyone is probably hypothesizing about why I left  either I m just plain rude or I have IBS   I m even more upset because just last night I sent an email to this prof asking if she had any research opportunities open and now I feel like she hates me  She won t want me working for her if I m not punctual    It s a class of about     people and I was in the second last row but on the opposite side of the door so it was a bit of a walk  I tried to leave as quietly as possible but the chairs are just so loud and my raincoat was crumpling against itself 
226,Participate in a    minute study for a chance to win a cash prize       ,2,pujkkw,Mod Approved,https://www.reddit.com/r/Anxiety/comments/pujkkw/participate_in_a_15minute_study_for_a_chance_to/,0,2021-09-24,This study aims to investigate relationships between emotion perception and different forms of anxiety  and is important in gaining more knowledge in this field  The study consists of some questions prior to a fun reaction task   This study has to be done on a   laptop    since it cannot be performed on a mobile phone  It should only take about       minutes to complete   You will have the opportunity to enter a drawing so you can be one of the lucky ones to win    if you finish the study  You can enter the drawing by providing an email at the start    https   allocate monster IDVTMAIK  https   allocate monster IDVTMAIK 
227,I m a grown man and I m afraid to get my  nd Pfizer shot  Today marks   weeks since my  st   ,261,pujh57,Needs A Hug/Support,https://www.reddit.com/r/Anxiety/comments/pujh57/im_a_grown_man_and_im_afraid_to_get_my_2nd_pfizer/,222,2021-09-24,The  st shot I was a mess beforehand  Even the xanax barely helped  But I did it  Only has a sore arm and woke up sweaty lol  But I hear the  nd shot is more likely to really beat you up  My dad s  nd he felt nothing  My teenage siblings felt achey and fatigued  Hope I don t get it bad  I m going to drug myself again and go get the  nd shot today   
228,Do I Have OCD  Or OCD Tendencies ,1,puj11k,Advice Needed,https://www.reddit.com/r/Anxiety/comments/puj11k/do_i_have_ocd_or_ocd_tendencies/,0,2021-09-24,Before I say anything im definitely going to get myself referred for evaluation on this  It s a strange one because of another component  Im an alcoholic  I guess ill just run through the story quickly  I was hospitalised in January due to withdrawal trying to quit and it was quite traumatic  I spent five days there in sheer panic and anxiety but I was safe  When I was released this us were things started to get a little  off  Before bed  I would start doing things in threes  Pull the handle of my door to make sure it was locked three times  rubbed my Witcher medallion I have over my mirror three times  then for some reason lightly tapped my chest three times  And I would pull on my e cig three times during the day  other times not  It always thought of it as good luck  I did this for about two three months until one night I thought why the fuck am I doing this  And it stopped  I stopped thinking about it  And that was that  Until I started drinking again and had withdrawal  not as bad  cut the relapse short   Now im three weeks sober  this night time ritual of threes is happening again like the last time   Also  this threes thing never happened before the start of this year and I ve not always been an alcoholic so I have no clue where it came from  And it s only this night time thing and my e cig that I can think of so it doesn t really interfere in my life  But it does worry me    Other information I guess is that I like things neat  But it doesn t bother me too much if it s not  Mildly sometimes  It s more stuff I can see  If it s in a drawer if it s packed away folded that s enough  Shut and done  But stuff on my cabinet is quite neat and lined up  Id probably move stuff it it weren t but this would literally be maybe five minutes tops a day  You wouldn t look at my room and think this guy s got OCD  you d probably just think he s tidy  Im not overly clean  I am hygienic though like my room or me doesn t stink hah  but neat  If that makes sense   So yeah  what do you guys think 
229,I love catastrophizing every time something goes wrong in my relationship  Good stuff       ,5,puiygc,Family/Relationship,https://www.reddit.com/r/Anxiety/comments/puiygc/i_love_catastrophizing_every_time_something_goes/,3,2021-09-24,I love my brain              Very good yes   So wonderful  I love thinking about how he is going to leave me and doesn t love me anymore and that I dont mean much to him because he felt sad and left out of a conversation due to a miscommunication   This is great  Anxiety rocks  
230,I m constantly scared for my future,3,puiujz,Advice Needed,https://www.reddit.com/r/Anxiety/comments/puiujz/im_constantly_scared_for_my_future/,0,2021-09-24,Everyone around me seems to be doing so well meanwhile I m just a dumb useless person  I suck at talking  I m confused all the time  nobody likes me and I hate myself  No matter how you look at it  if future employer were to look at me and my friends they ll obviously choose them  I feel like we re running the same race but my start is way behind theirs and it s exhausting trying to catch up  I try my best but is still nowhere near them
231,Living in the moment,1,puiogi,Discussion,https://www.reddit.com/r/Anxiety/comments/puiogi/living_in_the_moment/,1,2021-09-24,What are some things that you do to help you live in the moment 
232,Does anybody have a pituitary tumor that might be causing Anxiety,1,puimjy,Health,https://www.reddit.com/r/Anxiety/comments/puimjy/does_anybody_have_a_pituitary_tumor_that_might_be/,1,2021-09-24,I got really bad anxiety starting when I was    it kinda came out of nowhere  I never had it before I until     I got blood work done and turned out I have a tumor on my pituitary gland  My anxiety was unmanageable for around   months or so then tapered off and Gradually got better  I ve been off my meds for the tumor for a long time and my anxiety seems to have come back like it did before 
233,Am I crazy to be wary of working in a coffee shop inside a hospital ,3,puiil4,Advice Needed,https://www.reddit.com/r/Anxiety/comments/puiil4/am_i_crazy_to_be_wary_of_working_in_a_coffee_shop/,5,2021-09-24,I have pretty bad anxiety about working so I can t tell if I m just looking for an excuse to back out or if it s a legit concern   I m not vaccinated and I assume healthy people don t hang around the hospital coffee shops  At the same time this is the only place that invited me to an interview so far  What if I can t find anything else  And maybe I really am crazy to be worrying about this  maybe I ll find something wrong with any place that offers me a job   I just need some outsider perspective 
234,Anyone else get pins and needles in feet ,4,puifd8,Discussion,https://www.reddit.com/r/Anxiety/comments/puifd8/anyone_else_get_pins_and_needles_in_feet/,3,2021-09-24,I seem to get it more in one foot than the other  if i sit on the toilet or my arm chair with my feet flat on the floor they start to tingle  This normal   Also if i am on my feet my feet feel like they are mild burning but when i lift them up they are fine sometimes not sure if it s because my legs are tired and i have been on them all week or what  I do suffer with health anxiety to note 
