,title,score,id,flairs,url,n_comments,created,body
0,Dissociation  I don t think I can live long like this,1,pv7hh6,Venting,https://www.reddit.com/r/Anxiety/comments/pv7hh6/dissociation_i_dont_think_i_can_live_long_like/,0,2021-09-25,I feel hopeless  I ve been suffering from anxiety disorder since college  Last year  I ve started suffering from a bad health anxiety  I started having panic attacks  Then just recently  I started having this fear of going insane  I started dissociating which makes my anxiety panic worse  I feel like I m losing control and that the reality is slipping    Now  health anxiety and dissociation when combined are the worst  I go from thinking I m going insane to thinking I m going insane   probably because I have a tumor which I know I don t because I had a normal brain MRI a year ago  Still  I m eager to get another brain MRI just to be sure    Also  I m always light headed  My head feels empty and also heavy almost all the time  I feel like  I m only half focused aware  When I walk I feel like I walk weird and that everything is fuzzy  And when I read  I have to try harder for the sentences to register in my head  I mean I understand them but I forget them right away  It scares me so much that the panic anxiety is almost constant  Any slight movement can trigger my anxiety  So far  I never had hallucinations  But this combination of extreme fears is making me feel like I m gonna go insane  It s so exhausting and depressing  I want to give up on life so bad  I can t take this anymore     can someone please give some advice  I ll be starting my meds tomorrow  It s for anxiety and depression  I haven t told my doctor about dissociation because it s just recently 
1,When did you know you have anxiety or panic attacks ,2,pv7cd4,Discussion,https://www.reddit.com/r/Anxiety/comments/pv7cd4/when_did_you_know_you_have_anxiety_or_panic/,4,2021-09-25,I also suffer from anxiety and panic attacks and I want to hear your stories  It makes me feel as if I am not alone in this battle  Thanks
2,  TW SA  Nightmare vent,1,pv78rf,Venting,https://www.reddit.com/r/Anxiety/comments/pv78rf/tw_sa_nightmare_vent/,0,2021-09-25,I needed a place to vent this out since my gf is in college and everyone in my house is asleep      So im not ranting  and to some it up  Last night i had a nightmare where i was on a school trip and i ended up being r      d and tortured by one of school teachers      I cant get it out of my head  i think there were some serious metaphors for my past in there and i feel like i wanna cry    Sorry if this is the wrong place im still  pretty new to posting on reddit 
3,Huge anxiety and stress at new work assignment  How to handle ,2,pv75s0,Work/School,https://www.reddit.com/r/Anxiety/comments/pv75s0/huge_anxiety_and_stress_at_new_work_assignment/,0,2021-09-25,Hi all  I work as an IT data specialist consultant at a consultancy firm in a western European country  Now currently I am one week into a new assignment where I m seconded to a company and it is absolutely making me mentally stressed out  even now on the weekend constantly thinking about work  ruminating all the time  not being able to sleep  highly emotional  to the point that it is making me physically ill  headaches  waking up with a knot in my stomach  fatigued etcetera   It is my second assignment after having been seconded about   years to another company   Now personally  I think there are a number of factors contributing to this     First one is probably the biggest and is within myself  in that I m quite anxious by nature and new job situations are always tricky to me unless I know that the job at hand is one that I can handle      with my skills or I can at least get by with a bit of learning  This anxiety is something I m planning on getting professional help with  but right now that anxiousness is all too prevalent and not helping    Second is that the  first  project I was put on at this new company requires knowledge of a tool unknown to me  I am the only specialist that is going to work on that part  so I don t really have someone to work with who can guide me  Also this project has a tight deadline that I doubt I can make under these circumstances  I think my seniority in this was overestimated  since it s a whole new game as oppossed to what I did before    Third is that even with this project going which is already probably hard to complete by the deadline  a flock of people is coming to me to ask me to help on their projects  which is also a lot to handle   Now I m feeling shit the whole time  even when I m off of work  I told my manager at my consultancy firm the problems that I was encountering and also the stress and physical symptoms it is causing me to have  He was very understanding and trying to accomodate to make the new place work for me  He also said that they d stand behind me and that if things didn t work out  they would search something else for me   This made me feel a bit more relaxed for a while  but after that it has been non stop worrying and feeling bad again for me  Now I m quite worried that if I go on like this  it will have longer lasting effects on my health   As I see it now  it s just too much for me given my current mental state  Is it too much to ask from my employer to take me off the assignment and find a more fitting easier one for me  Given that I ve been a good  loyal and hard working employee before  Never sick  making the clients happy  During this time of an easier assignment I want to go to a psychologist to handle the anxiety I have  to avoid these things in the future   This has become a bit of a rant but I m just kind of losing it here and am afraid of my mental state right now   
4,Advice needed for partner s imagined medical anxiety   Potential medical trigger ,1,pv73kh,Advice Needed,https://www.reddit.com/r/Anxiety/comments/pv73kh/advice_needed_for_partners_imagined_medical/,0,2021-09-25,I  M    am married to an anxious person  F     She is anxious because of an abusive childhood  and it manifests in a lot of different ways  She does a lot of catastrophizing and the worst is her imagined medical issues  She will stub her toe and think it will result in her having to have her leg amputated which will result in me leaving her which will result in her death  etc  Her main trigger is imagined cancer    If her shoulder hurts  if her side hurts  if her chest hurts  if she has period cramps  if she has a headache  etc  anything will make her think it s secretly cancer and she is      going to die  We know that she behaves this way as a way to protect herself  to keep her  alert  of a threat  We also know some of the anxiety might be alleviated by regular physical check ups  but of course we re American and thus don t have health care   She also has some issues with medical situations doctors that also causes anxiety    We are working on the doctor situation  but I know that won t solve everything since we can t just go to a doctor for every bruise and stomachache   She loses a lot of sleep every night fantasizing about how she s dying  how this is the last four hours of her life  how I ll react when I wake up to her dead  or how I ll react if she has to go through cancer treatments  etc   etc   etc  She knows she shouldn t think about stuff  but she is incapable of turning off her brain  She will obsess about things for days  and then the cat will playfully bite her and she ll obsess about dying from a cat bite for the next few days until the next thing captures her imagination   She is already in therapy  and she has specifically talked to this therapist  and other  past therapists  about this issue  So far  none of them have given her any useful ways to deal with these intrusive thoughts  She is also incapable of googling how to fix stuff like this because just googling stuff will implant a new fear into her head   I m sure some of you know how it is    What can I do to help  What can she do to help  There are nights she gets very little sleep because she s up all night thinking she s having a heart attack or whatever  which only makes her anxiety worse when she has to get up early for work  etc   It is really stressful for me  too  both because I can t help  and because I feel like my partner isn t present because she s obsessing over imagined illnesses   Any help is appreciated  thanks   PS this is my first time posting here  If there is a better place for me to post this  please just let me know 
5,Not so fun story,1,pv72nf,Venting,https://www.reddit.com/r/Anxiety/comments/pv72nf/not_so_fun_story/,0,2021-09-25,I been having anxiety and depression problems since my early teens     now  and for the past few months felt better than ever with no meds or anything until I injured my eardrum few weeks ago    I can handle pain quite well that was not a problem  not fun either but manageable  The real horror started with vertigo  got an inner ear inflammation because of the eardrum problem that gave me constant dizziness  lightheadedness and nausea  and of course my old friend anxiety kicked in and been having constant anxiety and panic attacks since then  After the ear cleared out i had chest tightness and tingling in left arm  so I freaked out even more and went to A E  and after blood samples  x rays of heart and lungs everything was in perfect condition so the doctor told me it s my anxiety  I felt better the same day  but then in next few days i started filing tingling in my left cheek  and last night tingling in arm and face got worse  started getting worried and panic attack kicks in wit a headache and shortness of breath and trouble concentrating on whatever people are telling me in that moment so I  make another trip to the A E with the same result  but without x ray or mri because doctor was so confident it s just stress and anxiety  as he explaind me if it was something more serious  i would loose muscle feeling so my face would droop  and I wouldn t be able to move my hand    I had million panic attacks and anxiety issues over the years but they ve never gave me such physical symptoms that lasted for days and weeks  so whoever is reading this  go and check yourself out definitely   but don t panic  because if you think it s your head it probably is 
6,Really struggling with anxiety right now after a night of drinking ,1,pv71st,Needs A Hug/Support,https://www.reddit.com/r/Anxiety/comments/pv71st/really_struggling_with_anxiety_right_now_after_a/,1,2021-09-25,Hi all  I don t normally drink a ton  And tonight I may have had   drinks the whole night  That said even then my sleep isn t that interrupted by it and Id generally go home and pass out and wake up the next day    Right now is very different  And I m scared   I can t sleep for more than like    minutes at a time  My thoughts are racing so fast they don t even feel like mine  When I was dreaming my thoughts were also racing so fast it felt like the characters within my dreams were all malfunctioning  Without the auditory hallucination piece it literally feels like I have multiple voices in my head all trying to follow their own train of thought  And I m ping ponging too and from every thought that comes up  Like I have no control of my thoughts    Is this typical for anxiety  What is this  It feels like I ve lost some major sense of control  or like I just snapped  Like I m about to being taken over by other personalities or something  It took some effort even writing this and staying focused 
7,I have a guilty secret that if my parents find out or anybody I know  I will not be talked to and will lose all trust  It s eating me alive ,1,pv6z4w,Venting,https://www.reddit.com/r/Anxiety/comments/pv6z4w/i_have_a_guilty_secret_that_if_my_parents_find/,2,2021-09-25,To get down to it  I unfortunately had  Phone sex  in my case  meaning just texting the other recipient dirty texts and they wanted to send nude photos but I never sent any in return  Which most people do  but if my parents found this out  they would stop talking to me entirely  be extremely disappointed  and my distant family as well would stop talking to me due to beliefs so telling them to get this off my chest is NOT an option AT ALL  I now think that maybe the other person would tell their parents which would tell mine or it would leak out somehow  It s ruining my whole mood and it s clear to see  I m freaking panicking  I want to get a therapist to help 
8,My whole day was ruined by a single text by a most likely scammer ,1,pv6ur7,Venting,https://www.reddit.com/r/Anxiety/comments/pv6ur7/my_whole_day_was_ruined_by_a_single_text_by_a/,3,2021-09-25,This morning I noticed that yesterday while I was in new york I received a text from a number i ve never contacted before and assumed it was a scammer  But this text was different from the rest  I don t remember it perfectly but it went something like   K I want to get something off my chest and talk to you like mature people    This was extremely weird  I was going to respond but decided to block it  Before I did  I noticed that at the bottom of the text messages it said   This user is not receiving text messages due to focus mode  it s a new ios    feature that I don t personally think a bot would use since it s so new  Now I blocked the number but am literally panicking because if it was bad news I don t want to know  I have       feeling they are real  And I just don t know how to deal with this today 
9,How do I handle the anxiety when posting on social media ,1,pv6upa,Advice Needed,https://www.reddit.com/r/Anxiety/comments/pv6upa/how_do_i_handle_the_anxiety_when_posting_on/,2,2021-09-25,Every time I posted on social media I feel like I m being judged by other users  I mean I  crave  to see people s reactions yet at the same time I m also so nervous that I cannot stop checking my phone  And every time people are liking my posts  I feel so excited yet at the same time anxious that I cannot stop checking my phone  or even thinking about it   I m prone to think something may be wrong with my posts if someone s seen my posts yet they are not liking them   Is there something wrong with the way I see social media  How do I stop feeling this way  how can I be more confident in expressing myself  even online  And by social media I m referring to something like Instagram  I have no idea why I don t feel nervous at all when posting on Reddit  probably because nobody here knows me  I tried so hard not to care yet this feeling is not going away 
10,I m worried I ll never overcome agoraphobia  Feeling down   looking for advice support ,2,pv6rhw,Discussion,https://www.reddit.com/r/Anxiety/comments/pv6rhw/im_worried_ill_never_overcome_agoraphobia_feeling/,4,2021-09-25,So I bought a book the other day that use low intensity CBT techniques to treat agoraphobia  I ve been slowly working through it and I m feeling positive but it s only been a week   things take time   Today I was supposed to attend a family gathering but even with taking my anxiety meds  which usually help   I still couldn t leave my house   I just don t know how I m going to move on from this current state of anxiousness  I used to be a relatively social person who d study  go to work  see my friends regularly  travel by myself   take random trips to places   Three years later  i e  Now  I m a shell of myself  I have no friends  I can t work due to anxiety   other MH conditions   my future doesn t look bright if this continues   If anyone s reading this who s overcome agoraphobia  how did you do it  Do you have any advice   Thanks in advance 
11,Tinnitus and Anxiety Flare Up,1,pv6jen,Venting,https://www.reddit.com/r/Anxiety/comments/pv6jen/tinnitus_and_anxiety_flare_up/,0,2021-09-25,  m  Have had GAD and T as long as I can remember  T was generally mild and never paid attention to it  GAD could occasionally get bad and cause symptoms  But never worsened T    A week ago  I noticed a slightly new T sound  No idea what causes it  Sent me into a full panic questioning everything I did leading up to it  trying to figure out what caused it since I don t listen to loud music  work in loud areas  or game on loud volume  Recounting every single noise I heard leading up to the morning I first noticed the new flutter pitch  Needless to say  I became hyperparanoid about EVERY sound I heard at home in ways I never have  I hear annoying high pitches from fridge and Xbox fan I didn t used to hear  but idk if it s because I m listening too much now or what  I also think I m interpreting random tv sounds on broadcast as having an annoying loud high pitched ring    I m scared to do anything  Unfortunately have to wait    more days to see audiologist  In the meantime  I m afraid it s only downhill from here  I m scared to use an electric toothbrush  not sonic   electric razor  drive  do laundry  get a haircut  etc  the hundreds and hundreds of google searches and Reddit searches have only made my feelings worse  Wear ear plugs when driving  Oh wait  another post says not to   I drive a      sedan  Not the quietest thing in the world but I m sure it s better than some louder trucks or utility vans   Am I over sensitive  Is it the anxiety  Will I decline to the point I can t watch tv or cut my hair  It s so much to think about   I m not on medication for anything 
12,Visual disturbances with anxiety ,2,pv6ctf,Needs A Hug/Support,https://www.reddit.com/r/Anxiety/comments/pv6ctf/visual_disturbances_with_anxiety/,2,2021-09-25,Hi   So this past week has been really tough for me  I started to notice some visual disturbances last friday  I ve been having floaters  flashes  and then my peripheral vision is like static  fuzzy and shaky sometimes  I m just curious if anyone else deals with  visual disturbances or not  I ve had myself convinced I have a brain tumor or something due to these symptoms   I don t really have any other symptoms along with the visual stuff besides dizziness  which I ve been dealing with for a few years now  so nothing new there  I have no idea why the first thought when i ve been having these symptoms is something in my brain but the anxiety i ve been feeling is insane  I ve wanted to go to the ER a few times  but with covid I m nervous to do so  and i m just nervous in general to find out anything potentially bad  I just try to reassure myself it s my anxiety but then my mind starts wondering what if it s not your anxiety  it s a crazy cycle  I figured i d post here and see if anyone can relate or has dealt with the same thing 
13,Idk what to do,1,pv68op,Work/School,https://www.reddit.com/r/Anxiety/comments/pv68op/idk_what_to_do/,0,2021-09-25,I have a Monday thru Friday job and I recently applied somewhere else for a weekend shift  today I was supposed to start training at  am  well I got there and was like    minutes late I saw allot of cars there and my anxiety started kicking in I just kept driving back and forth deciding if I should go in or not and guess what I didn t go in I was so nervous and anxious as I was going to be the only one late there for training so I emailed my manager to tell her I was not able to come in due to a family emergency but she has not answered yet and now I m Nervous all over again contemplating if I should just tell them to withdraw my application because if I do stay I m going to be the only one doing training next week due to me not going today I literally hate myself for overthinking so much I regret not going in earlier fuck my life
14,I ve had enough,1,puou46,Venting,https://www.reddit.com/r/Anxiety/comments/puou46/ive_had_enough/,0,2021-09-24,I m done with it all  For two and a half years I ve been stuck in an anxiety loop that I can t break  It s a health anxiety and if someone told me I didn t have this condition with      certainty  I would be so happy and it would stop  The problem is  there s no way to test for it and give a yes or no diagnosis  I ve been tested for it and told that I likely don t have it  but I still experience the symptoms out of nowhere and the only people that I know have these symptoms are the people that have this illness   It s epilepsy  and it scares the shit out of me  I had two seizure incidents as a child  I have tried so hard to trust the doctors and the experienced medical professionals that have dealt with me but I still get symptoms  I think that it s going to happen at any second  so I get scared no matter where I am or what I m doing  I can DO things  but I do them because it s a necessity and have to rush home  If I try to enjoy things like walks  films  music  video games  there is this constant slow burning anxiety underneath that is telling me that  it  could happen at any moment  If I get the symptom  that s it  my day is done and I m on my bed all day waiting for it to happen   I ve gone through four different SSRI s  anti anxiety medication  therapy  exposure therapy  a healthier lifestyle  I stopped drinking two years ago  I have zero caffeine  But still  it persists all day everyday  I cannot give anything any attention  I have this loop in my head ALL day EVERYDAY      days a year  I ve also tried just  letting it work itself out   Nope  does nothing  I was told to be kind to myself and if I needed to spend days or weeks doing nothing then to do it  I did it  it didn t help   I haven t been able to work for four months  because my anxiety has now manifested in to completely physical symptoms  I ve been able to rationalise my thoughts  but the anxiety still wrecks havoc on my body  I don t get palpitations  racing heart  fast slow breathing  No  I get the stupidest symptoms ever  I become instantly fatigued  like I ve been hit by a truck of exhaustion  my eyes are visibly heavy  I go pale  I look physically sick and my legs go like jelly  like I m narcoleptic   I ve now recently purchased a blood pressure machine  an oxygen meter  a blood sugar reader  Because I m trying to diagnose myself with something  because there s something happening with me physically and I m convinced of it  There is no joy in my day  the person I was a few years ago has gone and been replaced by someone I do not know  I m scared of everything  I m a idiot and all I want to be is a functioning person who contributes to society   I ve resigned myself to the fact that my life is going to be like this until I die  Because no matter how hard I work  no matter how much I put it  it doesn t make a difference  It doesn t make the tiniest dent in how I feel   The doctors are out of ideas other than depression and anxiety  I m out of ideas and I m becoming numb  you could tell me I d die tomorrow and I d feel that it was deserved because all I m doing is wasting people s time and energy   Fuck you anxiety  you ve ruined my life  you ve fucked everything up 
15,If my resting heart rate is usually     And I take   mg of propranolol for anxiety before a social situation or before a presentation  how drastically will   mg drop my heart rate ,1,pv5yv8,Medication,https://www.reddit.com/r/Anxiety/comments/pv5yv8/if_my_resting_heart_rate_is_usually_60_and_i_take/,4,2021-09-25, Conserving I took the pill while my heart rate was     Will   mg drop my rate to   bpm Or something too low 
16,Things I did to help with my anxiety,2,pv5vwq,Helpful Tips!,https://www.reddit.com/r/Anxiety/comments/pv5vwq/things_i_did_to_help_with_my_anxiety/,0,2021-09-25,So i think more than a week ago  I posted about having this anxiety and how i get bloated then it would lead to not being able to breath then would lead to an attack  Its a vicious cycle    I did some research and read an article on having a healthy gut  Something about mind gut connection  Anyways I started drinking probiotics  It took about   weeks before I saw some improvements and now the bloating is lessened  I don t know if its placebo but my mom noticed it as well  That my tummy isnt as big as before  There is still some bloating but not as bad as before  I also watch how much food I eat  More veggies too    Then I also started using this app  Helps with meditation  My bpm is usually high  Too much thinking  stress etc    Im on my  th day today using this meditation app and my bpm is on the    to    resting  This was hard for me to achieve before  And also it helps with sleep  Even without meds my bpm is at    to     Small steps i keep on telling myself    Had an anxiety attack a month ago but still feeling the effects  The fear is still there  Once in a while it creeps in but its more manageable now  I bought this herb that I will try and will update you on its effects  Suppose to lessen anxiety and stress  Till next time 
17,Being anxious right now,1,pv5ka2,Advice Needed,https://www.reddit.com/r/Anxiety/comments/pv5ka2/being_anxious_right_now/,0,2021-09-25,I have an exam coming up in one week  and feels really anxious about it   My problem is i have been anxious for around two years  Also after I graduated this year  I struggle between preparing this coming exam and finding a job   This Thursday night  a toxic  friend  came to me and asked something from me  The reason I say this friend is toxic  is because she s the type of person I cannot trust  I have insomnia  so kinda dealt her at   am yesterday   The worst choice I made in this month  because now my anxiety has been lighten up  I have been in a bad shape for    hours now  I cannot focus on the coming exam  or just have a good sleep  Basically can do nothing but being anxious   What should I do right now   Thanks a lot 
18,Head,1,pv5by3,Health,https://www.reddit.com/r/Anxiety/comments/pv5by3/head/,0,2021-09-25,Does anyone experience head pressure or has a tension headache 
