,title,score,id,flairs,url,n_comments,created,body
95,Discovered my dad is the root of my anxiety   cutting him out of my life   need advice or hear from someone who has gone through a similar situation,5,puwm6p,Family/Relationship,https://www.reddit.com/r/Anxiety/comments/puwm6p/discovered_my_dad_is_the_root_of_my_anxiety/,1,2021-09-25,I have struggled with panic anxiety disorder and ptsd for a while now  In      I got a really bad panic anxiety attack and thought something was wrong with my heart  That year there were a lot of visits to the emergency room  hospitals and my doctor  They suspected something could be wrong with my heart  and had to have a   h EKG a couple of times  and they did an ultrasound of my heart  Nothing turned up  and my heart was healthy  No one thought to suggest that it could be anxiety  so I went on with my life and it stopped for a while  Turns out I had a lot of minor anxiety attacks after this  and then it got really bad again in December last year  This was hands down my worst panic anxiety attack ever     x   B   Since then I went to a see a therapist  We found out that a lot of my anxiety attacks were because how my then stepmom treated me  She was verbally abusive all the time  and in some cases she was even physically abusive  This is were my PTSD stems from  I would for example get anxiety attacks if someone opened the door too fast  like she did  because that sound meant she was coming to scream at me   For a while I thought the root of my anxiety was her  cause I get really stressed if I think I m doing something the wrong way etc  So I knew the PTSD and the fear of doing something the incorrect way was because of her  but I still felt something was missing  It didn t explain all of my anxiety     x   B   Recently I discovered that the root of my anxiety is my dad  That was when everything clicked in place  My mom said I have always been an anxious kid  The most annoying thing was that I always had to go to the bathroom no matter where we were and what we were doing  when my stresslevel is really high  I have to go to the bathroom really bad and often     My dad always put work before anything else  So from when I was around   years old  my dad would go to work before I usually woke up and come home late at night when I was asleep  If I wanted to see him  I had to wake up without an alarm clock or without my dad waking me up  I remember I always woke up in a panic and was really afraid that he was gone and would get out of my bed as fast as I could  run down the stairs and look out the window to see if his car was gone  If the car was gone  I would just cry hysterically for a really long time  and there was little my mom could do to calm me down  He was usually home on sundays but he didn t really spend much time with me   When I was   up to   or   years old  before my parents slipt up  he would sometimes drive me to school and my siblings to kindergarden  I remember I just wanted to talk to him when he did this  but he was always on the phone the whole time and told us not to interrupt  I would often get so mad that I just walked away from him and walked to school myself  It took him a while to notice I was gone  If I didn t walk away  he would usually forget to drop me off at school  I was the last kid he would drop off   so he just drove right past it while on his phone  Then he would get mad at me for not reminding him that I was still in the car     x   B   When I was around   years old  my parents had split up and he was living by himself  We would spend time at his place every other weekend and every thursday  But those days were often cancelled because he had to work or just wanted to go out partying instead of spending time with us  When we were there  he was usually talking on his phone due to work  so we wouldn t really get to spend time with him  I would often get so mad that I ran away  and would often find a spot where I could see the road to see how long it would take before he noticed I was gone and went out looking for me  It usually took around an hour or two    Sometimes my dad would take us places  but it was usually because he was doing activities with his friends  often paintball   and we just had to sit and watch them play for a couple of hours  and then he was back on his phone     x   B   When I was    he got together with my then stepmom and quickly moved in with her and her two kids  Her kids always ruined our things  ran after us with swords or knives and just generally hurting us  her son for example broke my sister s arm and knocked out a tooth   Our then stepmom started to verbally abuse us pretty quickly and I told this to my dad several times  He refused to listen and just told me that I was exaggerating or that I just misunderstood the whole situation  I remember my mom eventually set up a meeting where my dad had to show up so that I could voice my concerns  He got really angry  said that he refused to listen to it and just stormed off  After this my dad told me I had to apologize to my then stepmom and needed to be nice to her  I had to live with them until I was    when I moved away  From I was   to    I tried several times to tell my dad how my then stepmom was but I was shut down as quickly as all the other times I did  In this time period I also tried to tell my grandmom  my father s mom  what was going on  but she too refused to listen  When I told my friends about the situation  or my boyfriends  they all said I was exaggerating and refused to believe me    In my teenage years I got pretty wild  and could pretty much do whatever I wanted without my dad questioning me why I was out all night or what I was doing  I could come home drunk and he wouldn t do much about it  I realize now that this was pretty much a cry for help and trying to get him to notice me    My then stepmom would also be verbally abusive right in front of him  and he would just ignore the situation and didn t do anything about it    I moved out when I was     but my then stepmom and my dad was my boss  so from    to    years old  I had to deal with her while I was on work  I needed the money      x   B   So I realize now where my insecurities come from and why I have anxiety and why I had the need to be noticed or acknowledged  Now I get a panick attack every time my stresslevel goes up and I can get a panick attack from pretty much anything  not just specific things     From    years old to now     years old  he hasn t been good at reaching out  asking me how I m doing and stuff like that  I rarely see him and I rarely speak with him  I realized all this for just a couple of days ago  I have now decided to cut him out of my life  based on something that happened this week  Last week he said he was coming to my town for a job meeting  and he made plans to go out to eat with me while he was in town  Two days before he was supposed to come to my town  I saw on snapchat that he and his family  his new girlfriend and their two kids  was traveling here  I didn t hear anything from him the first day they were in town  and I didn t hear anything from him the second day either  And then I saw on snapchat that they have gone home  I didn t hear a word from him  We had plan for the next day and I knew then that our plans would not happen  as usual  He often comes to my town for job meetings but never think to let me know  and the few times he does  he cancels on me   Then the day came  and I heard nothing  Today I got a message from him where he straight up lied to me  explaining that he hadn t traveled to my town and that the travel was cancelled because of the storm  the storm came in the afternoon the day we had plans  not the two whole days while he actually were in my town      x   B   I honestly feel really angry and disappointed at this moment  I ve decided to cut him out of my life cause this is too toxic for me  and he doesn t respect me  I ve also discovered that he has been talking trash about my fianc   whom he has met briefly a few times  I ve realized that after    years I m just done trying to get my dad s attention and affection  I m just done  And I realize that this means that I will probably lose contact with my grandmother  because she thinks my dad can do no wrong and refuses to listen if we tell her something she doesn t want to hear about him  This whole situation has driven my anxiety to go haywire     Sorry for the long post  I just had to get it out      Has anyone else been in a similar situation  I would love to hear it  or just general advice cause at the moment I feel like I m being a huge asshole for doing this  Thanks 
96,Idk if it s anxiety but what do heart palpitations feel like  Just been vaccinated,3,puwi6g,Health,https://www.reddit.com/r/Anxiety/comments/puwi6g/idk_if_its_anxiety_but_what_do_heart_palpitations/,1,2021-09-25,I cant tell if I have palpitations from my first dose or if its just my anxiety
97,Should I go to my family doctor ,1,puwav1,Advice Needed,https://www.reddit.com/r/Anxiety/comments/puwav1/should_i_go_to_my_family_doctor/,1,2021-09-25,I ve been dealing with what Ive assumed to be anxiety my entire life  since I can remember  so like   or     Im no doctor but I know it has to be some sort of anxiety disorder  It s affected everything I do for years and years on end and my lifestyle is entirely based around my fear    Anyways  I was wondering what steps I should take to finally get this treated  Would it be worth it to first go to my family doctor 
98,Crippling fear of death,1,puw7va,Needs A Hug/Support,https://www.reddit.com/r/Anxiety/comments/puw7va/crippling_fear_of_death/,4,2021-09-25,Hopefully this is the right place to post this    I ve recently been struggling with major fear of death  I use to have an issue with it as a kid  but it didn t last long  Now ever time I see my parents all I see is them dying on the way home or dying just going to get groceries  I see my mom being shot my someone at the event all because they are drunk and angry  I see my dad having another heart attack  I see my husband dying while on a     call  he s a paramedic  or someone plowing into their ambulance  These thoughts are so vivid it makes me physically sick  I ll cry for so long  I worry constantly  I don t know how to push through this    If it matters in   F  I do have depression  GAD and BPD  We think I have undiagnosed ADHD as well  I ve been seeing the same therapist for years and she actually recommended I try to find a community on Reddit to find others who have the same fear and what helps them  Back in      I spent two months in an out patient treatment center because I attempted to take my life  I was not in a good place and I feel like I m going back there  I don t want to 
99,Clonazepam vs Lorazepam,3,puw3po,Medication,https://www.reddit.com/r/Anxiety/comments/puw3po/clonazepam_vs_lorazepam/,3,2021-09-25,Howdy   I m      I asked my doctor to help me with anxiety I was first given Clonazepam which I felt made me a bit sluggish  I would take a     pill once or twice a week    I asked if there is anything less sleepy and was given Lorazepam   Couldn t feel much of a difference but boy did I feel sad and depressed the next day  Just very sad and hopeless    I decided that Lorazepam is just horrible for me   I like to enjoy a drink or two during the week and I make sure to not take any meds if I know I will have a few drinks     Anyone else experience these severe downs with Lorazepam  
100,How do I avoid being in a depressed mood while travelling in early October,2,puw2g5,Discussion,https://www.reddit.com/r/Anxiety/comments/puw2g5/how_do_i_avoid_being_in_a_depressed_mood_while/,0,2021-09-25,I often get in a low mood while trying to have fun or wanting to enjoy myself  Happens in the summer and at Christmas every year since those are my favorite times of the year  Here I am travelling in October to a wedding and am going to go out a week early and site see in Colorado  I will be alone Saturday through Wednesday and won t have conversations to distract me  How do I stay in a good mood  It s also my   th birthday that week which is why I am taking the trip though the birthday is not until Friday the  th and I will be with people that day     How do I avoid being sad 
101,Fucking over everything,1,puw1mz,Venting,https://www.reddit.com/r/Anxiety/comments/puw1mz/fucking_over_everything/,0,2021-09-25,I am fucking over everything    I am a college senior and the thought of graduating in May makes me cry  You see  I have a chaotic home life and the thought of having to move back into that chaos is so anxiety provoking  I have my dad who is emotionally volatile and any thing can set him off  Sucks to be around someone like that  never know when he is going to go off  I feel like there are so many expectations that come along with getting older and I still feel as though I am        even though I am     In some ways  I miss high school I miss being young  I don t know   I just feel so mediocre compared to everyone else  Everyone around me has these crazy opportunities that come their way and I struggle even to reach out  Getting my current internship was such a challenge and I already fucked it up  There s a certain way that I want to execute myself and I m pissed that I can t come across the way that I do in my mind  I can do so much more  Then  I hate being a friendless senior  It sucks  On one hand  it s my fault that I don t do more to stay in contact with people and consistently go to club meetings  Then its so stressful to hear people around me talk about post grad life and they talk about in such a negative way  Yes  working is  fucking hard  but I feel like for me  I have to work    or else  I will just keep getting deeper in my anxiety  Plus  I don t even know what I want to do with my life   I feel so mediocre  Then on top of that  I have horrible body image issues and fucked up eating habits because I am very overweight and I m short  So that fucking sucks  Then I feel like once you reach a certain age  people expect more from you  I am    and still live at home  only first had an internship and the remarks from people just make me feel like a fucking failure  I m like    and people still think I m in high school   how demoralizing when in just a couple of months I will be a college graduate  I used to see a fucking therapist but he was a complete asshole who made me feel like shit every time I left the appointment  I already carry so much shame and shit that he said didn t help  Each session he was like  Oh you went to residential remember this      Bitch  that was fucking   years ago  I can barely remember what I did yesterday  Then this fucking asshole months ago implied that I wouldn t get my driver s license  I explained my situation to him over and over again and he still wasn t fucking grasping it  Well I passed anyways  so fuck him  His fucking remarks are the only reason why I passed because I wanted to prove this asshole wrong  Getting my driver s license was such a major accomplishment for me and his reaction was so subpar  I was so excited  Oh and then on top of that  I feel different from other people with anxiety disorders  Other people seem like they are still able to have friends  go to parties  network and do other shit  Well  I fucking struggle like there is no tomorrow with that  Now back to the asshole therapist  he fucking implied that I was a hermit and for weeks  he would badger me on dropping the sorority I was in  I fucking hated this sorority and was he the one paying for it  NOPE          pLUS it was so cliqueish and it ended up shutting down      x   B   I want to find a new therapist but this process is so fucking annoying  I fucking hate going through the whole intake and shit  I thought about going back to my old therapist that I saw between the ages of          but ultimately decided against it because maybe I need a fresh start with a new therapist and I was a teen back then and I m now an adult 
102,Scared of not being able to help,1,puvwk8,Advice Needed,https://www.reddit.com/r/Anxiety/comments/puvwk8/scared_of_not_being_able_to_help/,1,2021-09-25,So I ve been going to a therapist for some time now  and made a lot of improvements over the months  but now I m scared that I won t the able to help someone   I m obsessed with making everything to help other  and people around me are starting to say that I m diving in to deep into others people s problems by trying to pull everyone else up  but for me it just doesn t feel right not to do everything I can to help someone   This is getting to the point where I start another anxiety medication   now   in total  to keep myself together and not get absolute demolished by everything around me   I was to drunk and high when someone needed me  and from there on i can t forgive myself and I ve been doing everything I can to try to help  i can t sleep if my phone isn t on max volume  i feel like I m always walking on eggs when around others to not cause trouble   Everyone tells me that  you aren t going to change the world  and that I m going in way to deep most of the times  but all of that goes against my beliefs and I keep jumping into wells to try to pull other people other people out of them   I made a small mistake a few days ago and I lost    kg in one day because of the stress that it caused me   I don t know what do to from here  i know I will keep placing other people wellbeing in front of mine and I m scared shitless that i will breakdown again and then not be able to help anyone and burden other people in the process 
103,please reassure me changing jobs won t ruin my life,1,puvtj1,Needs A Hug/Support,https://www.reddit.com/r/Anxiety/comments/puvtj1/please_reassure_me_changing_jobs_wont_ruin_my_life/,2,2021-09-25,i got a job offer which is good  and the pay is better  and it lets me work from home unlike my current   i am terrified of    bad work culture or more stressful workload  i would be the only woman in this tech startup team   having less vacation days  its unlimited pto but will they pressure me     bad work life balance  they have an oncall rotation and im scared itll be bad ive never done oncall before  please if you have gone through these things just tell me it ll be fine and worth risking or that it turned out okay for you or whatever thank you
104,Is the white  yellow cottage cheese sticky substance coming from my nose normal   URGENT   ,1,puvt0b,Health,https://www.reddit.com/r/Anxiety/comments/puvt0b/is_the_white_yellow_cottage_cheese_sticky/,2,2021-09-25,Ok so I have a cold   kinda nearing to end I think  and it was is super bad with like chest heaviness and mucus in chest and coughs and sore throat and mucus in throat and bubble in nose and nasal drip and dizziness and a fever and runny nose and a stuffy nose etc etc all that stuff  and my right ear has been blocked for a couple days because of it I think  I can still hear but it s lower   maybe the other ear blocked too   With like a bit of whooshing sounds coming every now and then  like wind blowing  So today i was blowing my nose because my nose has been feeling STUFFYYY for days like I got the cold on Monday late weekend and now it s Friday and my nose has been feeling so full and every time I blow there s like a bubble in there and I blow it back up and it goes in my throat and I swallow and I choke and so on  But      it feels like there s a build up of snot and congestion and my throat sounds so nasally      it s so hard to breathe from my nose so I was blowing and blowing and it s so hard to get the snot out like when it did come out it was yellow and white and sticky and looked like cottage cheese and in my nose it had kinda a blue tinge but then I blew it out and it was either yellow or white and it was so sticky and thick  And i kept on blowing and blowing and more kept on coming it was so hard to get out idk if this is like build up  for days or something else I need to get checked out cos this carried on for like a full    or    minutes and u still feel bubbles in my nose EVERYTIME I breathe and stuff and it feels full  So is this all normal  Is this part of the cold  I also coughed up like yellow mucus too a couple times  I ve also been rubbing my nose so much there s like a red bump at the opening inside my nose lol  Will this all go away soon or a sign of something more serious like an ear infection or something else I need to get treated  Also every time I breathe I can feel the bubbles in my nose u know what I mean 
105,Taking buspirone in the day or at night ,1,puvo88,Medication,https://www.reddit.com/r/Anxiety/comments/puvo88/taking_buspirone_in_the_day_or_at_night/,1,2021-09-25,I just got prescribed this and am uncertain about when to take it  Ive heard mixed things about taking it at both times
106,Sudden chest pain causing me to panic,1,puvl2n,Health,https://www.reddit.com/r/Anxiety/comments/puvl2n/sudden_chest_pain_causing_me_to_panic/,2,2021-09-25,Ok so have the anxiety where I worry about my overall health and I was just laying down and my chest had this very painful and sharp pain in It and I haven t worried in a week and now I m getting scared  I know it s not a heart attack because being    it s very very unlikely but now I m on anxiety mode
107,I m uncomfortable in my apartment,1,puviv1,Advice Needed,https://www.reddit.com/r/Anxiety/comments/puviv1/im_uncomfortable_in_my_apartment/,10,2021-09-25,Ever since I moved into my apartment  I have felt uncomfortable  The energy just does not seem right  and I have troubles sleeping  I have tried to decorate my place  I also have many house plants   Other info  I work from home  and my window faces east but does not get direct sunlight   months out of the year   My apartment is a studio where each  room  has an arched open doorway wall separating the three  rooms   The arched doorway is as large as   in wide   If you walk in thru my front door from the hallway  you are in my office with the kitchen on your left and bedroom on your right   Standard kitchen  really  with a furnace in it  my office and dining room  desk  eating table  book case  are the same function  My bedroom also serves as my living room  tv  couch  and closet on one side  bed on the other    I struggle to feel at peace  I struggle falling asleep staying asleep waking up   When I sleep in my childhood bedroom at my parents  most of these issues subside   Any advice is very much appreciated  I cannot afford to move due to where I live  but I can afford to redecorate 
108,Will everything be okay ,5,puveiv,Advice Needed,https://www.reddit.com/r/Anxiety/comments/puveiv/will_everything_be_okay/,4,2021-09-24,Will everything be okay  I feel so lost with my life  I feel like a failure  I feel like I m running out of time
109,Better Help,5,puveb9,Advice Needed,https://www.reddit.com/r/Anxiety/comments/puveb9/better_help/,25,2021-09-24,Has anybody here actually tried using it   
110,Does anyone ever get anxious when they see a friend post online,1,puvcrf,Needs A Hug/Support,https://www.reddit.com/r/Anxiety/comments/puvcrf/does_anyone_ever_get_anxious_when_they_see_a/,2,2021-09-24,Hi I m new to this subreddit and am currently dealing with anxiety from the loss of my father in December of       After my father passed away in December of      I had been doing well I never felt anxious about anything really but after I got a new job in August where I ve been more isolated I ve had multiple breakdowns where I relive the night when my father died  I brought it up with a female friend and my girlfriend  After that it felt good to finally let people know what I was going through and it was the first step for me to get help  But now whenever I see my female friend post anything online I get extremely anxious and feel trapped  My mind has associated seeing her with my anxiety and it seems to be getting worse  I am going to bring this up with my counselor next week and see what he thinks i should do but I think cutting contact for with her for awhile might be the best solution  Please let me know if anyone else has had this and what they did to help it 
111,My grades PLUMMETED this year and i ve never been this stressed out in my life,4,puvc7o,Work/School,https://www.reddit.com/r/Anxiety/comments/puvc7o/my_grades_plummeted_this_year_and_ive_never_been/,1,2021-09-24,Edit  OK GUYS IM GOING TO STOP COMPLAINING AND IM GOING TO GET ALL THE WEEK S WORK DONE NOW AND IM GOING To STUDY FOR MY EXAMS WOOOO UH im going to post on this sub again next week and be like  i got my grades up    I ve ALWAYS been an A student  my entire life  Now im a senior in HS  So I started taking classes at community college in the mornings  I take three classes there per semester  psychology  public speaking  and personal finance  God they are so hard I have B s in two of them and a C in one and its stressing me out so much when my parents find out theyre going to go insane and im so worried  I also work as a freelancer so i have to write around   k words in research writing marketing a week  and i ALSO have highschool full time  and ALSO i got hired at the grocery store and im going to be working    hours a week starting next week and I love that im doing all this cause i need money but it is absolutely at the expense of my grades and im caring more about making money than good grades now  Honestly  i dont care about school at all anymore  Which is a feeling ive never felt because ive always been so worried about it  Now i cant bring myself to try cause it seems useless anyways  grades are dumb  but then seeing that i have bad grades is worrying me so much and idk what to do  I think im going to use it as a motivator to try realy hard on my next few assignments and bump up my grades for all those classes  but still  im really stressed out about it and i had to rant lol
